[
  {
    "id": "demo-source",
    "title": "示範資料，非正式攻略內容：來源",
    "sourceType": "official-website",
    "publisherOrAuthor": "Demo Publisher",
    "sourceLevel": "official",
    "url": "https://example.invalid/maken-shao-demo",
    "publicationDate": null,
    "accessedDate": "2026-07-15",
    "notes": "示範資料，非正式攻略內容。此來源只用於驗證資料結構。"
  },
  {
    "id": "atlus-maken-shao-index-archive",
    "title": "魔剣爻 - MAKEN SHAO",
    "sourceType": "official-website",
    "publisherOrAuthor": "株式会社アトラス（Atlus）",
    "sourceLevel": "official",
    "url": "https://web.archive.org/web/20030415141611/http://www.atlus.co.jp/cs/game/pstation2/shao/index.html",
    "publicationDate": null,
    "accessedDate": "2026-07-16",
    "notes": "Atlus PS2 產品頁的 Internet Archive 保存版。可查證 PS2 平台、2001-06-07 發售、動作冒險類型，以及魔劍／分歧結局的官方介紹。原始 Atlus URL 已失效。"
  },
  {
    "id": "atlus-maken-shao-story-archive",
    "title": "魔剣爻 - ストーリー",
    "sourceType": "official-website",
    "publisherOrAuthor": "株式会社アトラス（Atlus）",
    "sourceLevel": "official",
    "url": "https://web.archive.org/web/20021222112807/http://www.atlus.co.jp/cs/game/pstation2/shao/story.html",
    "publicationDate": null,
    "accessedDate": "2026-07-16",
    "notes": "Atlus 故事頁的 Internet Archive 保存版。可查證 Image（イマージュ）的官方定義、近未來背景、金澤總合學術研究所與魔劍專案的設定。原始 Atlus URL 已失效。"
  },
  {
    "id": "atlus-maken-shao-system-page1-archive",
    "title": "魔剣爻 - ゲームの特徴 Page1",
    "sourceType": "official-website",
    "publisherOrAuthor": "株式会社アトラス（Atlus）",
    "sourceLevel": "official",
    "url": "https://web.archive.org/web/20021222112830/http://www.atlus.co.jp/cs/game/pstation2/shao/gmsys.html",
    "publicationDate": null,
    "accessedDate": "2026-07-16",
    "notes": "Atlus 系統頁的 Internet Archive 保存版。可查證 Brain Jack、身體差異與其對動作／劇情的影響。原始 Atlus URL 已失效。"
  },
  {
    "id": "atlus-maken-shao-system-page2-archive",
    "title": "魔剣爻 - ゲームの特徴 Page2",
    "sourceType": "official-website",
    "publisherOrAuthor": "株式会社アトラス（Atlus）",
    "sourceLevel": "official",
    "url": "https://web.archive.org/web/20021222112830/http://www.atlus.co.jp/cs/game/pstation2/shao/gmsys2.html",
    "publicationDate": null,
    "accessedDate": "2026-07-16",
    "notes": "Atlus 系統頁的 Internet Archive 保存版。可查證角色後方第三人稱、鎖定與戰鬥描述；原始 Atlus URL 已失效。"
  },
  {
    "id": "atlus-maken-shao-system-page3-archive",
    "title": "魔剣爻 - ゲームの特徴 Page3",
    "sourceType": "official-website",
    "publisherOrAuthor": "株式会社アトラス（Atlus）",
    "sourceLevel": "official",
    "url": "https://web.archive.org/web/20021222112830/http://www.atlus.co.jp/cs/game/pstation2/shao/gmsys3.html",
    "publicationDate": null,
    "accessedDate": "2026-07-16",
    "notes": "Atlus 系統頁的 Internet Archive 保存版。可查證 Image Point、同步率、技能與 Brain Jack 所需點數；原始 Atlus URL 已失效。"
  },
  {
    "id": "game-watch-maken-shao-2001-02-23",
    "title": "アトラス、相手の身体を乗っ取って戦う 3Dアクションアドベンチャー、PS2「魔剣爻」",
    "sourceType": "other",
    "publisherOrAuthor": "GAME Watch／株式会社インプレス；北村孝和",
    "sourceLevel": "secondary",
    "url": "https://game.watch.impress.co.jp/docs/20010223/atlus.htm",
    "publicationDate": "2001-02-23",
    "accessedDate": "2026-07-16",
    "notes": "同期遊戲新聞；可獨立交叉印證 PS2 的角色後方第三人稱、Brain Jack、Image 累積與技能。不可取代官方一手說明。"
  },
  {
    "id": "kadokawa-maken-shao-official-guidebook",
    "title": "魔剣爻 公式ガイドブック",
    "sourceType": "official-guide",
    "publisherOrAuthor": "KADOKAWA／Enterbrain",
    "sourceLevel": "official",
    "url": "https://www.kadokawa.co.jp/product/200700004318/",
    "publicationDate": "2001-07-07",
    "accessedDate": "2026-07-16",
    "notes": "出版社書目紀錄，ISBN 9784757705197。僅可證實官方攻略本的存在、出版資訊；未取得正文，不能據此推導攻略或設定細節。"
  },
  {
    "id": "gamehyoron-maken-shao-route-table",
    "title": "「魔剣爻」の攻略（ステージ分岐、エンディング等）",
    "sourceType": "other",
    "publisherOrAuthor": "ゲーム瓢論",
    "sourceLevel": "community",
    "url": "https://web.archive.org/web/20160216213837/http://gamehyoron.com/kouryaku/maken/maken-b.htm",
    "publicationDate": null,
    "accessedDate": "2026-07-16",
    "notes": "PS2 日版社群分歧表；可定位開局、早期分歧、中盤解鎖、支線與終盤路線。另有 2016-02-16 Wayback 保存。非官方來源，所有具體路線仍標為交叉驗證或社群單一來源。"
  },
  {
    "id": "gamehyoron-maken-shao-stage-index",
    "title": "「魔剣爻」の攻略",
    "sourceType": "other",
    "publisherOrAuthor": "ゲーム瓢論",
    "sourceLevel": "community",
    "url": "https://web.archive.org/web/20150503104344/http://gamehyoron.com/kouryaku/menu/maken.htm",
    "publicationDate": null,
    "accessedDate": "2026-07-16",
    "notes": "PS2《魔剣爻》社群攻略索引，直接列出序盤、中盤與終盤區域清單。清單可證明頁面涵蓋範圍，但不等同官方唯一順序。"
  },
  {
    "id": "gamehyoron-maken-shao-midgame",
    "title": "「魔剣爻」の攻略（中盤ステージ攻略）",
    "sourceType": "other",
    "publisherOrAuthor": "ゲーム瓢論",
    "sourceLevel": "community",
    "url": "https://web.archive.org/web/20150709025813/http://gamehyoron.com/kouryaku/maken/maken-s2.htm",
    "publicationDate": null,
    "accessedDate": "2026-07-16",
    "notes": "PS2 日版社群中盤關卡攻略；與分歧表共同支持伊斯坦堡／雅典／梵蒂岡／里昂及倫敦／阿姆斯特丹兩條解鎖鏈。"
  },
  {
    "id": "gamehyoron-maken-shao-endgame",
    "title": "「魔剣爻」の攻略（終盤ステージ攻略）",
    "sourceType": "other",
    "publisherOrAuthor": "ゲーム瓢論",
    "sourceLevel": "community",
    "url": "https://web.archive.org/web/20150709025813/http://gamehyoron.com/kouryaku/maken/maken-s3.htm",
    "publicationDate": null,
    "accessedDate": "2026-07-16",
    "notes": "PS2 日版社群終盤攻略；用於交叉確認紫禁城與崑崙是不同終盤，而非固定線性連續關卡。"
  },
  {
    "id": "kentaro-maken-shao-early-chart",
    "title": "魔剣爻・チャート式攻略～金沢研究所→リヨン～",
    "sourceType": "other",
    "publisherOrAuthor": "kentaro.ifdef.jp",
    "sourceLevel": "community",
    "url": "https://web.archive.org/web/20050216152721/http://kentaro.ifdef.jp/v_date/maken.html",
    "publicationDate": null,
    "accessedDate": "2026-07-16",
    "notes": "2005 年 Wayback 保存的 PS2 日版逐區流程；與ゲーム瓢論交叉驗證早期 Brain Jack 分歧、中盤解鎖及部分支線。"
  },
  {
    "id": "kentaro-maken-shao-late-chart",
    "title": "魔剣爻・チャート式攻略～リスボン→紫禁城～",
    "sourceType": "other",
    "publisherOrAuthor": "kentaro.ifdef.jp",
    "sourceLevel": "community",
    "url": "https://web.archive.org/web/20050216152732/http://kentaro.ifdef.jp/v_date/maken2.html",
    "publicationDate": null,
    "accessedDate": "2026-07-16",
    "notes": "2005 年 Wayback 保存的 PS2 日版終盤分歧攻略。終盤選項依先前擊倒陣營數量而變化；未實機複驗的精確回答組合不寫成已驗證事實。"
  },
  {
    "id": "shoda-maken-shao-hints",
    "title": "[PS2]魔剣爻特設ページ",
    "sourceType": "other",
    "publisherOrAuthor": "Shoda",
    "sourceLevel": "community",
    "url": "https://web.archive.org/web/20010726172425/http://www.st.rim.or.jp/~shoda/tips/shao.html",
    "publicationDate": null,
    "accessedDate": "2026-07-16",
    "notes": "2001 年同期 PS2 專頁，明確區隔 DC 版並提供各區域簡短提示。不是完整流程；其《魔剣X》連結不得用來補 PS2 路線。"
  },
  {
    "id": "atlus-maken-shao-characters-archive",
    "title": "魔剣爻 - キャラクター紹介",
    "sourceType": "official-website",
    "publisherOrAuthor": "株式会社アトラス（Atlus）",
    "sourceLevel": "official",
    "url": "https://web.archive.org/web/20021222113246/http://www.atlus.co.jp/cs/game/pstation2/shao/chara.html",
    "publicationDate": null,
    "accessedDate": "2026-07-16",
    "notes": "Atlus PS2 官方角色介紹保存頁。正文與角色名圖像可直接查證魔劍、相模桂、山城弘的名稱及官方角色設定；本站保存 17 張可對應具名角色的原始圖檔作離線引用，並在資料列、角色卡與研究紀錄保留來源與著作權註記。"
  },
  {
    "id": "atlus-maken-shao-correlation-archive",
    "title": "魔剣爻 - キャラクター相関図",
    "sourceType": "official-website",
    "publisherOrAuthor": "株式会社アトラス（Atlus）",
    "sourceLevel": "official",
    "url": "https://web.archive.org/web/20030405045529/http://www.atlus.co.jp/cs/game/pstation2/shao/correlation.html",
    "publicationDate": null,
    "accessedDate": "2026-07-16",
    "notes": "Atlus PS2 官方角色相關圖保存頁。可查證封劍士一族、金澤總合學術研究所及三業會的官方組織說明；圖中未能由文字層可靠辨識的個別姓名不據此建檔。"
  },
  {
    "id": "blue-violet-maken-shao-characters",
    "title": "魔剣爻 キャラクター（ブレインジャックキャラクター）",
    "sourceType": "other",
    "publisherOrAuthor": "BLUE VIOLET",
    "sourceLevel": "community",
    "url": "https://blueviolet.ninja-web.net/game/maken/character.htm",
    "publicationDate": null,
    "accessedDate": "2026-07-16",
    "notes": "PS2《魔剣爻》社群角色頁，明列 18 名「ブレインジャックキャラクター」。只用於和其他 PS2 流程交叉確認可操作／Brain Jack 分類；不視為官方羅馬字或自由取得條件。"
  }
]
